MovieID,Title,Genre,Description,PhotoURL
M001,Inception,Sci-Fi,"A thief who steals corporate secrets through dream-sharing technology is given a chance at redemption.",/static/images/inception-movie-poster-dream-is-real-9ei1rpyath620n92.jpg
M002,Titanic,Romance,"A seventeen-year-old aristocrat falls in love with a kind but poor artist aboard the luxurious Titanic.",/static/images/images.jpeg
M003,The Godfather,Crime,"The aging patriarch of an organized crime dynasty transfers control of his clandestine empire to his reluctant son.",/static/images/godfather.jpeg
M004,Avengers,Action,"Earth's mightiest heroes must come together and learn to fight as a team to stop the mischievous Loki.",/static/images/avengers-vm16xv4a69smdauy.jpg
M005,Interstellar,Sci-Fi,"A team of explorers travel through a wormhole in space in an attempt to ensure humanity's survival.",/static/images/thumb-1920-546680.jpg
